{
  "$schema": "https://json-schema.org/draft/2020-12/schema",
  "title": "DĀR AL TAWḤĪD Apple TV Content Record",
  "type": "object",
  "required": ["id", "language", "narratorLine", "speakerLabel", "textMarkdown", "source", "grade"],
  "properties": {
    "id": { "type": "string", "pattern": "^HAD-[0-9]{4}$" },
    "recordType": {
      "type": "string",
      "enum": ["hadith", "athar", "dua"],
      "description": "Fehlt das Feld bei Altbeständen, wird der Datensatz als hadith behandelt."
    },
    "categoryLabel": { "type": ["string", "null"] },
    "language": { "const": "de" },
    "narratorLine": { "type": "string" },
    "speakerLabel": { "type": "string" },
    "textMarkdown": { "type": "string" },
    "source": { "type": "string" },
    "sourceBook": { "type": ["string", "null"] },
    "sourceVolume": { "type": ["string", "null"] },
    "sourcePage": { "type": ["string", "null"] },
    "sourceChapter": { "type": ["string", "null"] },
    "sourceSection": { "type": ["string", "null"] },
    "sourceHadithNumber": { "type": ["string", "null"] },
    "sourceEdition": { "type": ["string", "null"] },
    "grade": { "type": "string" },
    "verificationNote": { "type": ["string", "null"] },
    "sharhStatus": {
      "type": ["string", "null"],
      "enum": ["verified", "needs-review", "missing", null],
      "description": "Sharḥ wird nur angezeigt, wenn verified und sharhText gefüllt ist."
    },
    "sharhText": { "type": ["string", "null"] },
    "sharhLanguage": { "type": ["string", "null"] },
    "sharhScholar": { "type": ["string", "null"] },
    "sharhBook": { "type": ["string", "null"] },
    "sharhVolume": { "type": ["string", "null"] },
    "sharhPage": { "type": ["string", "null"] },
    "sharhChapter": { "type": ["string", "null"] },
    "sharhSection": { "type": ["string", "null"] },
    "sharhEdition": { "type": ["string", "null"] },
    "sharhReference": { "type": ["string", "null"] },
    "semanticDuplicateOf": { "type": ["string", "null"], "pattern": "^HAD-[0-9]{4}$", "description": "Optional reference to a semantically overlapping HAD record; does not imply a weak or invalid chain." }
  },
  "additionalProperties": false
}
