{"id":"HAD-1900","recordType":"athar","language":"de","narratorLine":"Nuʿaym ibn Ḥammād رحمه الله sagte:","speakerLabel":"Er sagte:","textMarkdown":"Wer Allah Seiner Schöpfung **gleichsetzt**, begeht Kufr; und wer leugnet, womit Allah Sich Selbst beschrieben hat, begeht Kufr. In dem, womit Allah Sich oder Sein Gesandter ﷺ Ihn beschrieben hat, liegt keine Gleichsetzung.","source":"al-Lālakāʾī, Šarḥ Uṣūl Iʿtiqād Ahl as-Sunnah, Bd. 2, S. 13","grade":"Imām-Aussage","verificationNote":"100er-Schritt 1851–1950; exakte klassische Fundstelle nach Quellenabgleich eingetragen."}