{"id":"HAD-2305","recordType":"hadith","categoryLabel":"ḤADĪṮ","language":"de","narratorLine":"ʿUmar ibn al-Ḫaṭṭāb رضي الله عنه berichtete:","speakerLabel":"Der Prophet ﷺ sagte:","textMarkdown":"Allah ist barmherziger zu Seinen Dienern als diese Frau zu ihrem Kind.","source":"Ṣaḥīḥ al-Buḫārī und Ṣaḥīḥ Muslim","sourceBook":"Ṣaḥīḥ al-Buḫārī; Ṣaḥīḥ Muslim","sourceVolume":null,"sourcePage":null,"sourceChapter":"Kitāb al-Adab; Kitāb at-Tawbah","sourceSection":"Bāb raḥmat al-walad wa-taqbīlihi wa-muʿānaqatihi","sourceHadithNumber":"al-Buḫārī 5999; Muslim 2754","sourceEdition":null,"grade":"Muttafaqun ʿalayh","verificationNote":"Nach Regel v6 geprüft: Ibn Baṭṭāls direkter Buḫārī-Kommentar zum Kapitel wird nach Prüfung der früheren al-Ḫaṭṭābī-Priorität verwendet; keine unsichere Seitenzahl.","sharhStatus":"verified","sharhText":"Ibn Baṭṭāl erklärt, dass der Ḥadīṯ die Weite der göttlichen Barmherzigkeit durch ein den Menschen unmittelbar verständliches Beispiel verdeutlicht. Die Barmherzigkeit der Mutter ist geschaffen und begrenzt; Allahs Barmherzigkeit gegenüber Seinen Dienern ist umfassender.","sharhLanguage":"de","sharhScholar":"Ibn Baṭṭāl","sharhBook":"Šarḥ Ṣaḥīḥ al-Buḫārī","sharhVolume":"9","sharhPage":null,"sharhChapter":"Kitāb al-Adab","sharhSection":"Bāb raḥmat al-walad wa-taqbīlihi wa-muʿānaqatihi","sharhEdition":"Maktabat ar-Rušd","sharhReference":"Ibn Baṭṭāl, Šarḥ Ṣaḥīḥ al-Buḫārī, Bd. 9, Kitāb al-Adab, Sharḥ al-Buḫārī 5999"}