{"id":"HAD-2628","recordType":"hadith","categoryLabel":"ḤADĪṮ","language":"de","narratorLine":"ʿAbdullāh ibn Masʿūd رضي الله عنه berichtete:","speakerLabel":"Der Prophet ﷺ sagte:","source":"Ṣaḥīḥ al-Buḫārī und Ṣaḥīḥ Muslim","sourceBook":"Ṣaḥīḥ al-Buḫārī; Ṣaḥīḥ Muslim","sourceVolume":null,"sourcePage":null,"sourceChapter":"Kitāb al-Adab; Kitāb al-Birr wa-ṣ-Ṣilah wa-l-Ādāb","sourceSection":"Bāb qubḥ al-kaḏib wa-ḥusn aṣ-ṣidq wa-faḍlih","sourceHadithNumber":"al-Buḫārī 6094; Muslim 2607","sourceEdition":null,"grade":"Muttafaqun ʿalayh","sharhStatus":"verified","sharhLanguage":"de","sharhScholar":"Qāḍī ʿIyāḍ","sharhBook":"Ikmāl al-Muʿlim bi-Fawāʾid Muslim","sharhVolume":"7","sharhPage":null,"sharhChapter":"Kitāb al-Birr wa-ṣ-Ṣilah wa-l-Ādāb","sharhSection":"Sharḥ Muslim 2607","sharhEdition":"Dār al-Wafāʾ","textMarkdown":"Wahrhaftigkeit führt zum Birr.","verificationNote":"Nach Regel v6 geprüft: al-Māzirī wurde als früheste Muslim-Priorität berücksichtigt; ein sicher greifbarer clause-spezifischer Direktkommentar wurde nicht gesichert. Qāḍī ʿIyāḍ kommentiert Muslim 2607 direkt.","sharhText":"Qāḍī ʿIyāḍ erklärt, dass beständige Wahrhaftigkeit den Menschen zu umfassendem Guten und Gehorsam führt. Ṣidq ist damit nicht nur eine einzelne Tugend, sondern ein Weg zu weiteren rechtschaffenen Eigenschaften.","sharhReference":"Qāḍī ʿIyāḍ, Ikmāl al-Muʿlim bi-Fawāʾid Muslim, Bd. 7, Sharḥ Muslim 2607"}