{"id":"HAD-2119","recordType":"hadith","categoryLabel":"ḤADĪṮ","language":"de","narratorLine":"Anas ibn Mālik رضي الله عنه berichtete:","speakerLabel":"Der Prophet ﷺ sagte:","textMarkdown":"Keiner von euch glaubt vollständig, bis er für seinen Bruder liebt, was er für sich selbst **liebt**.","source":"Ṣaḥīḥ al-Buḫārī und Ṣaḥīḥ Muslim","sourceBook":"Ṣaḥīḥ al-Buḫārī / Ṣaḥīḥ Muslim","sourceVolume":null,"sourcePage":null,"sourceChapter":"Kitāb al-Īmān","sourceSection":"Min al-Īmān an yuḥibba li-aḫīhi mā yuḥibbu li-nafsih","sourceHadithNumber":null,"sourceEdition":null,"grade":"Ṣaḥīḥ","verificationNote":"100er-Schritt 2051–2150; mit geprüftem Sharḥ erstellt.","sharhStatus":"verified","sharhText":"Ibn Raǧab erklärt, dass die Vollkommenheit des verpflichtenden Īmān verlangt, für den muslimischen Bruder das Gute im Dīn und im Diesseits zu lieben und ihm das zu wünschen, was man für sich selbst liebt.","sharhLanguage":"de","sharhScholar":"Ibn Raǧab al-Ḥanbalī","sharhBook":"Ǧāmiʿ al-ʿUlūm wa-l-Ḥikam","sharhVolume":null,"sharhPage":null,"sharhChapter":"Ḥadīṯ 13","sharhSection":"لا يؤمن أحدكم حتى يحب لأخيه ما يحب لنفسه","sharhEdition":null,"sharhReference":"Ǧāmiʿ al-ʿUlūm wa-l-Ḥikam, Ḥadīṯ 13; Fatḥ al-Bārī; Šarḥ an-Nawawī"}