{"id":"HAD-2075","recordType":"hadith","categoryLabel":"ḤADĪṮ","language":"de","narratorLine":"Abū Saʿīd al-Ḫudrī رضي الله عنه berichtete:","speakerLabel":"Der Prophet ﷺ sagte:","textMarkdown":"Es soll weder Schaden noch gegenseitige **Schädigung** geben.","source":"Sunan Ibn Māǧah; al-Muwaṭṭaʾ","sourceBook":"Sunan Ibn Māǧah / al-Muwaṭṭaʾ","sourceVolume":null,"sourcePage":null,"sourceChapter":"Kitāb al-Aḥkām","sourceSection":"Lā ḍarar wa-lā ḍirār","sourceHadithNumber":null,"sourceEdition":null,"grade":"Ḥasan","verificationNote":"100er-Schritt 2051–2150; mit geprüftem Sharḥ erstellt.","sharhStatus":"verified","sharhText":"Ibn Raǧab erklärt, dass der Ḥadīṯ eine große Rechtsregel ist: Es ist verboten, anderen ursprünglich Schaden zuzufügen oder mit unrechtmäßiger Gegenschädigung zu antworten. Schaden wird im Dīn beseitigt und nicht neu erzeugt.","sharhLanguage":"de","sharhScholar":"Ibn Raǧab al-Ḥanbalī","sharhBook":"Ǧāmiʿ al-ʿUlūm wa-l-Ḥikam","sharhVolume":null,"sharhPage":null,"sharhChapter":"Ḥadīṯ 32","sharhSection":"لا ضرر ولا ضرار","sharhEdition":null,"sharhReference":"Ǧāmiʿ al-ʿUlūm wa-l-Ḥikam, Ḥadīṯ 32"}