{"id":"HAD-1102","recordType":"athar","language":"de","narratorLine":"aš-Šāfiʿī رحمه الله ist überliefert:","speakerLabel":"Er sagte:","textMarkdown":"Wenn der Ḥadīṯ authentisch ist, dann ist er meine **Maḏhab**.","source":"al-Bayhaqī, Manāqib aš-Šāfiʿī","grade":"Imām-Aussage","verificationNote":"100er-Schritt 1051–1150; Salaf-Aussagen-Unterblock."}