{"id":"HAD-2123","recordType":"hadith","categoryLabel":"ḤADĪṮ","language":"de","narratorLine":"Abū Hurayrah رضي الله عنه berichtete:","speakerLabel":"Der Prophet ﷺ sagte:","textMarkdown":"Die Zeichen des Heuchlers sind drei: Wenn er spricht, **lügt** er.","source":"Ṣaḥīḥ al-Buḫārī und Ṣaḥīḥ Muslim","sourceBook":"Ṣaḥīḥ al-Buḫārī / Ṣaḥīḥ Muslim","sourceVolume":null,"sourcePage":null,"sourceChapter":"Kitāb al-Īmān","sourceSection":"ʿAlāmāt al-munāfiq","sourceHadithNumber":null,"sourceEdition":null,"grade":"Ṣaḥīḥ","verificationNote":"100er-Schritt 2051–2150; mit geprüftem Sharḥ erstellt.","sharhStatus":"verified","sharhText":"Ibn Ḥaǧar erklärt, dass diese Eigenschaften Zeichen praktischer Heuchelei sind. Sie zeigen eine innere Verderbnis im Verhalten, auch wenn die Person nicht dadurch allein aus dem Islam beurteilt wird.","sharhLanguage":"de","sharhScholar":"Ibn Ḥaǧar al-ʿAsqalānī","sharhBook":"Fatḥ al-Bārī","sharhVolume":null,"sharhPage":null,"sharhChapter":"Kitāb al-Īmān","sharhSection":"آية المنافق ثلاث","sharhEdition":null,"sharhReference":"Fatḥ al-Bārī zu Ṣaḥīḥ al-Buḫārī, Kitāb al-Īmān; Šarḥ an-Nawawī"}