{"id":"HAD-0881","recordType":"athar","language":"de","narratorLine":"Ḥudhayfah ibn al-Yamān رضي الله عنه ist überliefert:","speakerLabel":"Er sagte:","textMarkdown":"Die Menschen fragten nach dem Guten; ich fragte nach dem **Bösen**, aus Furcht, dass es mich trifft.","source":"Ṣaḥīḥ al-Buḫārī und Ṣaḥīḥ Muslim","grade":"Ṣaḥābah-Āṯar","verificationNote":"100er-Schritt 851–950; Ṣaḥābah-Āṯār-Unterblock."}