{
  "id": "HAD-0564",
  "recordType": "hadith",
  "language": "de",
  "narratorLine": "Abū Masʿūd al-Anṣārī رضي الله عنه berichtete:",
  "speakerLabel": "Der Prophet ﷺ sagte:",
  "textMarkdown": "Wer auf etwas Gutes hinweist, erhält den gleichen Lohn wie derjenige, der es **tut**.",
  "source": "Ṣaḥīḥ Muslim",
  "grade": "Ṣaḥīḥ",
  "verificationNote": "Arabischer Prophetenwortlaut und unmittelbar zugehöriger klassischer Originalkommentar geprüft, keine konkret bestimmte Druckedition, Seiten aus digitaler Werkpagination.",
  "sourceBook": "Ṣaḥīḥ Muslim",
  "sourceHadithNumber": "1893",
  "sourceChapter": "Kitāb al-Ǧihād wa-s-Siyar, Bāb faḍl man dalla ʿalā ḫayr",
  "sharhStatus": "verified",
  "sharhLanguage": "de",
  "sharhScholar": "Abū al-ʿAbbās al-Qurṭubī",
  "sharhBook": "al-Mufhim limā Aškala min Talḫīṣ Kitāb Muslim",
  "sharhVolume": "3",
  "sharhPage": "727–728",
  "sharhChapter": "Kitāb al-Ǧihād wa-s-Siyar, Bāb faḍl man dalla ʿalā ḫayr",
  "sharhSection": "Kitāb al-Ǧihād wa-s-Siyar, Bāb faḍl man dalla ʿalā ḫayr",
  "sharhEdition": null,
  "sharhText": "Al-Qurṭubī erläutert den Bericht, in dem ein Mann auf eine Möglichkeit hinwies, einem Reisenden mit untauglich gewordenem Reittier zu helfen. Die Verheißung „Wer auf Gutes hinweist, erhält Lohn wie der Handelnde“ erfasst die Mitwirkung durch sinnvolle Vermittlung, auch wenn der Hinweisgeber die gute Tat nicht selbst ausführt. Al-Qurṭubī erörtert ausdrücklich den Umfang dieser Gleichheit des Lohnes und lässt die Möglichkeit offen, dass Allah beiden gleichermaßen vergilt, da die Belohnung Seine Gunst ist. Diese Auslegung darf weder als Abzug vom Lohn des tatsächlich Handelnden noch als garantierter individueller Betrag dargestellt werden.",
  "sharhReference": "Abū al-ʿAbbās al-Qurṭubī, al-Mufhim limā Aškala min Talḫīṣ Kitāb Muslim, Bd. 3, digitale Werkpagination S. 727–728. Direkter Kommentar https://www.islamweb.net/ar/library/content/317/2430"
}
