{
  "id": "HAD-0331",
  "recordType": "hadith",
  "language": "de",
  "narratorLine": "ʿĀʾishah رضي الله عنها berichtete:",
  "speakerLabel": "Der Prophet ﷺ sagte:",
  "textMarkdown": "Wenn die Menstruation beginnt, lass das Gebet; wenn sie endet, wasch das Blut ab und **bete**.",
  "source": "Ṣaḥīḥ al-Buḫārī, Nr. 331",
  "grade": "Ṣaḥīḥ",
  "verificationNote": "Originaltext und Kommentar in Ibn Raǧabs Fatḥ al-Bārī direkt nach digitaler Werkpagination abgeglichen. Hinweise auf Wiederholung desselben Sachverhalts und fiqhrechtliche Unterschiede sind kenntlich. Konkrete Druckausgabe nicht identifiziert.",
  "sourceBook": "Ṣaḥīḥ al-Buḫārī",
  "sourceHadithNumber": "331",
  "sourceChapter": "Kitāb al-Ḥayḍ",
  "sourceSection": "Bāb iḏā raʾat al-mustaḥāḍah aṭ-ṭuhr",
  "sharhStatus": "verified",
  "sharhText": "Ibn Raǧab hebt bei dieser weiteren ʿĀʾišah-Überlieferung ausdrücklich hervor, dass al-Buḫārī sie hier wiederholt, um seine Unterscheidung zwischen dem Einsetzen und dem Ende der eigentlichen Menstruation zu verdeutlichen. Die Phrase „Wenn die Menstruation kommt ... wenn sie geht“ bezieht er hier insbesondere auf das Erkennen des charakteristischen Menstruationsblutes und dessen Übergang zu anderer anhaltender Blutung (Istiḥāḍah). Er verbindet diesen Kommentar mit der vorher dargelegten Meinung Ibn ʿAbbās' und der Auslegung Aḥmads und Isḥāq ibn Rāhawayhs. Das Nachlassen des eigentlichen Menstruationsblutes erlaubt nach der nötigen Reinigung die Wiederaufnahme des Gebets; die ältere ausführliche Erklärung derselben Rechtsfrage wird nicht als neuer unabhängiger Ausspruch ausgegeben.",
  "sharhLanguage": "de",
  "sharhScholar": "Ibn Raǧab al-Ḥanbalī",
  "sharhBook": "Fatḥ al-Bārī (Šarḥ Ṣaḥīḥ al-Buḫārī)",
  "sharhVolume": "1",
  "sharhPage": "544",
  "sharhChapter": "Kitāb al-Ḥayḍ",
  "sharhSection": "Bāb iḏā raʾat al-mustaḥāḍah aṭ-ṭuhr",
  "sharhEdition": null,
  "sharhReference": "Ibn Raǧab, Fatḥ al-Bārī, Bd. 1, S. 544, Kitāb al-Ḥayḍ, Bāb iḏā raʾat al-mustaḥāḍah aṭ-ṭuhr. Digitaler arabischer Direktnachweis: https://www.islamweb.net/ar/library/content/302/262",
  "semanticDuplicateOf": "HAD-0320"
}
