{"id":"HAD-2380","recordType":"hadith","categoryLabel":"ḤADĪṮ","language":"de","narratorLine":"Abū Saʿīd al-Ḫudrī رضي الله عنه berichtete:","speakerLabel":"Der Prophet ﷺ berichtete:","source":"Ṣaḥīḥ Muslim; Ṣaḥīḥ al-Buḫārī in verkürzter Fassung","sourceBook":"Ṣaḥīḥ Muslim; Ṣaḥīḥ al-Buḫārī","sourceVolume":null,"sourcePage":null,"sourceChapter":"Kitāb at-Tawbah; Aḥādīṯ al-Anbiyāʾ","sourceSection":"Bāb qabūl tawbat al-qātil wa-in kaṯura qatlah","sourceHadithNumber":"Muslim 2766; al-Buḫārī 3470","sourceEdition":null,"grade":"Muttafaqun ʿalayh bi-aṣl al-qiṣṣah","sharhStatus":"verified","sharhLanguage":"de","sharhScholar":"Qāḍī ʿIyāḍ","sharhBook":"Ikmāl al-Muʿlim bi-Fawāʾid Muslim","sharhVolume":"8","sharhPage":null,"sharhChapter":"Kitāb at-Tawbah","sharhSection":"Sharḥ Muslim 2766","sharhEdition":"Dār al-Wafāʾ","textMarkdown":"Ein Mann hatte neunundneunzig Menschen getötet und fragte nach dem wissendsten Menschen auf der Erde.","verificationNote":"Nach Regel v6 geprüft: al-Māzirī wurde als früheste Muslim-Priorität berücksichtigt; ein sicher greifbarer clause-spezifischer Direktkommentar wurde nicht gesichert. Qāḍī ʿIyāḍ kommentiert Muslim 2766 direkt im Kitāb at-Tawbah.","sharhText":"Qāḍī ʿIyāḍ hebt hervor, dass selbst ein Täter gewaltiger Sünden die Tür der Tawbah suchen kann. Dass der Mann gezielt nach dem Wissendsten fragt, zeigt die Notwendigkeit, in schweren religiösen Fragen zu wirklichem Wissen zurückzukehren.","sharhReference":"Qāḍī ʿIyāḍ, Ikmāl al-Muʿlim bi-Fawāʾid Muslim, Bd. 8, Kitāb at-Tawbah, Sharḥ Muslim 2766"}