{"id":"HAD-2760","recordType":"hadith","categoryLabel":"ḤADĪṮ","language":"de","narratorLine":"Abū Bakrah رضي الله عنه berichtete:","speakerLabel":"Der Prophet ﷺ sagte:","textMarkdown":"Zu den größten der großen Sünden gehört der ʿUqūq gegenüber den Eltern.","source":"Ṣaḥīḥ Muslim","sourceBook":"Ṣaḥīḥ Muslim","sourceVolume":null,"sourcePage":null,"sourceChapter":"Kitāb al-Īmān","sourceSection":"Bāb bayān al-kabāʾir wa-akbarihā","sourceHadithNumber":"Muslim 87","sourceEdition":null,"grade":"Ṣaḥīḥ","verificationNote":"Nach Regel v6 geprüft: Muslim 87 ist Ṣaḥīḥ. Qāḍī ʿIyāḍ ordnet den ʿUqūq in den direkten Kabāʾir-Šarḥ ein.","sharhStatus":"verified","sharhText":"ʿUqūq ist das schwere Verletzen der verpflichtenden Güte und Rechte der Eltern; seine Nennung zeigt die außergewöhnliche Stellung ihrer Rechte.","sharhLanguage":"de","sharhScholar":"Qāḍī ʿIyāḍ","sharhBook":"Ikmāl al-Muʿlim bi-Fawāʾid Muslim","sharhVolume":"1","sharhPage":"353–356","sharhChapter":"Kitāb al-Īmān","sharhSection":"Sharḥ Muslim 87","sharhEdition":"Dār al-Wafāʾ, 1. Aufl., 1419/1998","sharhReference":"Qāḍī ʿIyāḍ, Ikmāl al-Muʿlim bi-Fawāʾid Muslim, 1/353–356, Sharḥ Muslim 87"}