{"id":"HAD-2766","recordType":"hadith","categoryLabel":"ḤADĪṮ","language":"de","narratorLine":"ʿAbdullāh ibn Masʿūd رضي الله عنه berichtete:","speakerLabel":"Der Prophet ﷺ sagte:","textMarkdown":"Allah ist schön und liebt Schönheit.","source":"Ṣaḥīḥ Muslim","sourceBook":"Ṣaḥīḥ Muslim","sourceVolume":null,"sourcePage":null,"sourceChapter":"Kitāb al-Īmān","sourceSection":"Bāb taḥrīm al-kibr wa-bayānihi","sourceHadithNumber":"Muslim 91a","sourceEdition":null,"grade":"Ṣaḥīḥ","verificationNote":"Nach Regel v6 geprüft: Muslim 91a ist Ṣaḥīḥ. al-Māzirī kommentiert die Formulierung direkt; seine Erklärung wird in Ikmāl al-Muʿlim 1/360 bewahrt.","sharhStatus":"verified","sharhText":"Al-Māzirī erklärt, dass der Satz die Vollkommenheit Allahs und die Liebe zu erlaubter Schönheit bestätigt. Schöne Kleidung an sich ist kein Kibr.","sharhLanguage":"de","sharhScholar":"al-Māzirī","sharhBook":"al-Muʿlim bi-Fawāʾid Muslim","sharhVolume":"1","sharhPage":null,"sharhChapter":"Kitāb al-Īmān","sharhSection":"Sharḥ Muslim 91a","sharhEdition":"ad-Dār at-Tūnisiyyah","sharhReference":"al-Māzirī, al-Muʿlim bi-Fawāʾid Muslim, Bd. 1, Sharḥ Muslim 91a; frühe Erklärung bewahrt in Qāḍī ʿIyāḍ, Ikmāl al-Muʿlim"}