{"id":"HAD-2285","recordType":"hadith","categoryLabel":"ḤADĪṮ","language":"de","narratorLine":"Abū Hurayrah رضي الله عنه berichtete:","speakerLabel":"Der Prophet ﷺ berichtete von seinem Herrn عز وجل:","textMarkdown":"Wenn Ich ihn liebe, bin Ich sein Gehör, mit dem er hört, sein Blick, mit dem er sieht, seine Hand, mit der er greift, und sein Fuß, mit dem er geht.","source":"Ṣaḥīḥ al-Buḫārī","sourceBook":"Ṣaḥīḥ al-Buḫārī","sourceVolume":null,"sourcePage":null,"sourceChapter":"Kitāb ar-Riqāq","sourceSection":"Bāb at-Tawāḍuʿ","sourceHadithNumber":"al-Buḫārī 6502","sourceEdition":null,"grade":"Ṣaḥīḥ","verificationNote":"Nach Regel v6 geprüft: Ibn Baṭṭāls direkter Kommentar zu al-Buḫārī 6502 wird verwendet. Die Aussage wird im klassischen Šarḥ als besondere Führung, Bewahrung und Unterstützung des geliebten Dieners verstanden, nicht als Identität oder Vermischung zwischen Schöpfer und Geschöpf.","sharhStatus":"verified","sharhText":"Ibn Baṭṭāl versteht die Aussage als besondere göttliche Bewahrung und Führung: Der geliebte Diener wird in seinen Sinnen und Handlungen zu dem geleitet, was Allah liebt und erlaubt, und vor dem Gebrauch seiner Glieder im Ungehorsam geschützt.","sharhLanguage":"de","sharhScholar":"Ibn Baṭṭāl","sharhBook":"Šarḥ Ṣaḥīḥ al-Buḫārī","sharhVolume":"10","sharhPage":"212","sharhChapter":"Kitāb ar-Riqāq","sharhSection":"Bāb at-Tawāḍuʿ","sharhEdition":"Maktabat ar-Rušd","sharhReference":"Ibn Baṭṭāl, Šarḥ Ṣaḥīḥ al-Buḫārī, 10/212, Sharḥ al-Buḫārī 6502"}