{
  "recordType": "hadith",
  "categoryLabel": "ḤADĪṮ",
  "language": "de",
  "source": "Ṣaḥīḥ Muslim",
  "sourceBook": "Ṣaḥīḥ Muslim",
  "sourceVolume": null,
  "sourcePage": null,
  "sourceChapter": "Kitāb az-Zuhd wa-r-Raqāʾiq",
  "sourceEdition": null,
  "grade": "Ṣaḥīḥ",
  "sharhStatus": "verified",
  "sharhLanguage": "de",
  "sharhScholar": "al-Māzirī",
  "sharhBook": "al-Muʿlim bi-Fawāʾid Muslim",
  "sharhVolume": "3",
  "sharhChapter": "Kitāb az-Zuhd wa-r-Raqāʾiq",
  "sharhEdition": "ad-Dār at-Tūnisiyyah, 2. Aufl.",
  "id": "HAD-3234",
  "narratorLine": "ʿAbdullāh ibn ʿUmar رضي الله عنهما berichtete:",
  "speakerLabel": "Der Prophet ﷺ sagte:",
  "textMarkdown": "Der Prophet ﷺ sah im Traum zwei Männer um einen Miswāk ringen. Als er ihn zunächst dem Jüngeren gab, wurde ihm gesagt, den Älteren vorzuziehen; darauf gab er ihn dem Älteren.",
  "sourceSection": "Zuhd: Den Älteren bei Übergabe bevorzugen",
  "sourceHadithNumber": "Muslim 3003",
  "verificationNote": "Regel v6: Aussagekern gegen Ṣaḥīḥ Muslim 3003 und aktuelle Textnachweise geprüft; reine Isnād-/Wortlautvarianten nicht vervielfacht. Semantische Dublettenprüfung gegen den globalen HAD-Bestand abgeschlossen. al-Māzirī wird als früheste direkte Muslim-Priorität geführt; keine Druckseite geschätzt.",
  "sharhText": "Der Bericht begründet Adab der Vorranggabe an den Älteren in einer solchen Übergabesituation.",
  "sharhPage": null,
  "sharhSection": "Sharḥ Muslim 3003",
  "sharhReference": "al-Māzirī, al-Muʿlim bi-Fawāʾid Muslim, Bd. 3, Sharḥ Muslim 3003"
}
