{"id":"HAD-1117","recordType":"hadith","language":"de","narratorLine":"ʿĀʾišah رضي الله عنها berichtete:","speakerLabel":"Der Prophet ﷺ sagte:","textMarkdown":"Wer in diese unsere Angelegenheit etwas einführt, was nicht dazu gehört, es ist **zurückgewiesen**.","source":"Ṣaḥīḥ al-Buḫārī und Ṣaḥīḥ Muslim","grade":"Ṣaḥīḥ","verificationNote":"100er-Schritt 1051–1150; zweiter 20er-Ḥadīṯ-Unterblock."}