{
  "id": "HAD-0337",
  "recordType": "hadith",
  "language": "de",
  "narratorLine": "Abū al-Juhaym al-Anṣārī رضي الله عنه berichtete:",
  "speakerLabel": "Er sagte:",
  "textMarkdown": "Der Prophet ﷺ erwiderte den Salām erst, nachdem er zu einer Wand ging, sein Gesicht und seine Hände damit bestrich und dadurch **Tayammum** verrichtete.",
  "source": "Ṣaḥīḥ al-Buḫārī, Nr. 337",
  "grade": "Ṣaḥīḥ",
  "verificationNote": "Arabischer Hadith Nr. 337 und anschließender Ibn-Raǧab-Kommentar direkt eingesehen; Seitenmarken [ص 39] bis [ص 42] nach der digitalen Pagination geprüft. Keine konkrete Druckausgabe verifiziert. Die Argumentation über Wasserverfügbarkeit und Gebetszeit wird als Rechtsdiskussion, nicht als wörtlicher Hadith ausgegeben.",
  "sourceBook": "Ṣaḥīḥ al-Buḫārī",
  "sourceChapter": "Kitāb at-Tayammum",
  "sourceHadithNumber": "337",
  "sharhStatus": "verified",
  "sharhText": "Ibn Raǧab behandelt den Bericht von Abū Ǧuhaym: Der Prophet ﷺ erwiderte den Gruß erst, nachdem er an einer Wand über Gesicht und Hände gestrichen hatte. Der Kommentar unterscheidet zwischen einer nur empfohlenen Reinheit beim Gedenken beziehungsweise bei der Grußerwiderung und der vorgeschriebenen Reinheit für das Gebet. Ibn Raǧab erwähnt als mögliche Erklärung, dass an dem Ort kein Wasser verfügbar war; außerdem gibt er abweichende Gelehrtenmeinungen wieder, ob unter besonderen Umständen Tayammum vor einer unmittelbar drohenden Gebetsversäumnis zulässig ist. Der Bericht begründet kein allgemeines Verbot, den Salām ohne Wuḍūʾ zu erwidern.",
  "sharhLanguage": "de",
  "sharhScholar": "Ibn Raǧab al-Ḥanbalī",
  "sharhBook": "Fatḥ al-Bārī (Šarḥ Ṣaḥīḥ al-Buḫārī)",
  "sharhVolume": "2",
  "sharhPage": "39–42",
  "sharhChapter": "Kitāb at-Tayammum",
  "sharhSection": "Bāb at-tayammum fī al-ḥaḍar iḏā lam yaǧid al-māʾ wa-ḫāfa fawt aṣ-ṣalāh",
  "sharhEdition": null,
  "sharhReference": "Ibn Raǧab, Fatḥ al-Bārī, Bd. 2, S. 39–42, Kapitel Tayammum in der Stadt bei fehlendem Wasser und Befürchtung des Zeitablaufs. Arabischer Direkttext: https://islamweb.net/ar/library/content/302/278"
}
