{"recordType":"hadith","categoryLabel":"ḤADĪṮ","language":"de","speakerLabel":"Der Gesandte Allahs ﷺ sagte:","source":"Ṣaḥīḥ Muslim","sourceBook":"Ṣaḥīḥ Muslim","sourceVolume":null,"sourcePage":null,"sourceChapter":"Kitāb al-Īmān","sourceEdition":null,"grade":"Ṣaḥīḥ","sharhStatus":"verified","sharhLanguage":"de","sharhScholar":"Qāḍī ʿIyāḍ","sharhBook":"Ikmāl al-Muʿlim bi-Fawāʾid Muslim","sharhVolume":"1","sharhChapter":"Kitāb al-Īmān","sharhEdition":"Dār al-Wafāʾ, 1. Aufl., 1419/1998","id":"HAD-2818","narratorLine":"Abū Hurayrah رضي الله عنه berichtete:","textMarkdown":"Zu den Gefahren der Fitnah gehört, dass ein Mensch seinen Dīn für einen vergänglichen Anteil der Dunyā verkauft.","sourceSection":"Bāb al-ḥaṯṯ ʿalā al-mubādarah bi-l-aʿmāl qabla taẓāhur al-fitan","sourceHadithNumber":"Muslim 118","verificationNote":"Nach Regel v6 geprüft: Muslim 118 ist Ṣaḥīḥ; reine Varianten werden zusammengeführt.","sharhText":"Die Ursache des beschriebenen Abfalls wird mit weltlichem Tauschhandel ausgedrückt: zeitweiliger Nutzen wird über den Dīn gestellt. Der Ḥadīṯ mahnt deshalb zur Festigung des Īmān vor dem Eintreten solcher Prüfungen.","sharhPage":"395–396","sharhSection":"Sharḥ Muslim 118","sharhReference":"Qāḍī ʿIyāḍ, Ikmāl al-Muʿlim bi-Fawāʾid Muslim, 1/395–396, Sharḥ Muslim 118"}