{"id":"HAD-0560","recordType":"hadith","language":"de","narratorLine":"ʿĀʾishah رضي الله عنها berichtete:","speakerLabel":"Der Prophet ﷺ sagte:","textMarkdown":"**Sanftmut ist in keiner Sache, ohne sie zu verschönern; und sie wird aus keiner Sache entfernt, ohne sie zu entstellen.**","source":"Ṣaḥīḥ Muslim, Nr. 2594","grade":"Ṣaḥīḥ","verificationNote":"Duplikat von HAD-0521 mit bereits geprüftem Šarḥ. Nicht nochmals live aktivieren.","categoryLabel":"ḤADĪṮ","sourceBook":"Ṣaḥīḥ Muslim","sourceVolume":"4","sourcePage":"2004","sourceChapter":"Kitāb al-Birr wa-ṣ-Ṣilah wa-l-Ādāb","sourceSection":"Bāb faḍl ar-rifq","sourceHadithNumber":"2594","sourceEdition":null,"sharhStatus":"needs-review","sharhText":null,"sharhLanguage":"de","sharhScholar":null,"sharhBook":null,"sharhVolume":null,"sharhPage":null,"sharhChapter":null,"sharhSection":null,"sharhEdition":null,"sharhReference":"duplicate-of:HAD-0521"}