{"recordType":"hadith","categoryLabel":"ḤADĪṮ","language":"de","speakerLabel":"Der Gesandte Allahs ﷺ sagte:","source":"Ṣaḥīḥ Muslim","sourceBook":"Ṣaḥīḥ Muslim","sourceVolume":null,"sourcePage":null,"sourceChapter":"Kitāb al-Īmān","sourceEdition":null,"grade":"Ṣaḥīḥ","sharhStatus":"verified","sharhLanguage":"de","sharhScholar":"al-Māzirī","sharhBook":"al-Muʿlim bi-Fawāʾid Muslim","sharhVolume":"1","sharhPage":null,"sharhChapter":"Kitāb al-Īmān","sharhEdition":"ad-Dār at-Tūnisiyyah, 2. Aufl.","id":"HAD-2823","narratorLine":"ʿAmr ibn al-ʿĀṣ رضي الله عنه berichtete:","textMarkdown":"Der Ḥaǧǧ tilgt das, was vor ihm war.","sourceSection":"Bāb kawn al-Islām yahdimu mā qablahu wa-kaḏā al-hiǧrah wa-l-ḥaǧǧ","sourceHadithNumber":"Muslim 121","verificationNote":"Nach Regel v6 geprüft: Muslim 121 ist Ṣaḥīḥ. Früher Šarḥ nach al-Māzirī; keine unsichere Druckseite eingetragen.","sharhText":"Der aufrichtig vollzogene Ḥaǧǧ wird zusammen mit Islam und Hiǧrah als Ursache der Tilgung früherer Sünden genannt.","sharhSection":"Sharḥ Muslim 121","sharhReference":"al-Māzirī, al-Muʿlim bi-Fawāʾid Muslim, Kitāb al-Īmān, Sharḥ Muslim 121"}