{"id":"HAD-1106","recordType":"athar","language":"de","narratorLine":"al-Barbahārī رحمه الله ist überliefert:","speakerLabel":"Er sagte:","textMarkdown":"Wisse, dass der Islām die Sunnah ist und die Sunnah der **Islām**.","source":"al-Barbahārī, Šarḥ as-Sunnah","grade":"Imām-Aussage","verificationNote":"100er-Schritt 1051–1150; Salaf-Aussagen-Unterblock."}