{"id":"HAD-2045","recordType":"athar","language":"de","narratorLine":"aš-Šāfiʿī رحمه الله sagte:","speakerLabel":"Er sagte:","textMarkdown":"Die Muslime sind sich einig: Wer die Sunnah des Gesandten Allahs ﷺ klar erkennt, dem ist es nicht erlaubt, sie wegen der Aussage eines anderen zu **verlassen**.","source":"Ibn al-Qayyim, Iʿlām al-Muwaqqiʿīn","grade":"Salaf-Aussage","verificationNote":"100er-Schritt 1951–2050; gemischter Schlussblock, Āṯār-Teil."}