{"id":"HAD-0748","recordType":"athar","language":"de","narratorLine":"Sufyān ibn ʿUyaynah رحمه الله ist überliefert:","speakerLabel":"Er sagte:","textMarkdown":"Wer Wissen nimmt, soll mit Demut beginnen; Hochmut löscht **Nutzen**.","source":"Ibn ʿAbd al-Barr, Ǧāmiʿ Bayān al-ʿIlm","grade":"Salaf-Aussage","verificationNote":"Letzter Mischblock im 100er-Schritt 651–750."}