{"id":"HAD-0316","recordType":"hadith","language":"de","narratorLine":"ʿĀʾishah رضي الله عنها berichtete:","speakerLabel":"Sie sagte:","textMarkdown":"Bei der Abschiedspilgerfahrt bekam sie ihre Menstruation. Der Prophet ﷺ befahl ihr, das Haar zu lösen, es zu kämmen und die ʿUmrah **aufzuschieben**.","source":"Ṣaḥīḥ al-Buḫārī, Nr. 316","grade":"Ṣaḥīḥ","verificationNote":"Frühquellen-Prüfung: konkrete Buḫārī-Stelle und Kapitelzuordnung geprüft; Haupt-Šarḥ auf Ibn Baṭṭāl gesetzt. Die Handlung wird im Kapitel über das Kämmen des Haares bei der Reinigung nach Ḥayḍ geführt.","categoryLabel":"ḤADĪṮ","sourceBook":"Ṣaḥīḥ al-Buḫārī","sourceVolume":null,"sourcePage":null,"sourceChapter":"Kitāb al-Ḥayḍ","sourceSection":"Bāb imtišāṭ al-marʾah ʿinda ġuslihā min al-maḥīḍ","sourceHadithNumber":"316","sourceEdition":null,"sharhStatus":"verified","sharhText":"Ibn Baṭṭāl erklärt, dass das Lösen und Kämmen des Haares bei der Reinigung nach der Menstruation zulässig ist und zur gründlichen Reinigung beitragen kann. Im Fall ʿĀʾišahs رضي الله عنها war dies zugleich Teil der Umstellung ihrer Pilgerabsicht: Die Menstruation verhinderte nicht den Ḥaǧǧ, wohl aber den zunächst beabsichtigten Ṭawāf der ʿUmrah bis zur Reinheit.","sharhLanguage":"de","sharhScholar":"Ibn Baṭṭāl","sharhBook":"Šarḥ Ṣaḥīḥ al-Buḫārī","sharhVolume":"1","sharhPage":null,"sharhChapter":"Kitāb al-Ḥayḍ","sharhSection":"Bāb imtišāṭ al-marʾah ʿinda ġuslihā min al-maḥīḍ","sharhEdition":null,"sharhReference":"Ibn Baṭṭāl · Šarḥ Ṣaḥīḥ al-Buḫārī · Kitāb al-Ḥayḍ · Bāb imtišāṭ al-marʾah ʿinda ġuslihā min al-maḥīḍ · Band 1"}